{
  "$schema": "http://json-schema.org/draft-07/schema#",
  "type": "array",
  "items": {
    "type": "object",
    "required": ["id", "title", "description", "url", "status", "complexity"],
    "properties": {
      "id": { "type": "string", "pattern": "^[a-z0-9-]+$" },
      "title": { "type": "string", "minLength": 1 },
      "description": { "type": "string" },
      "url": { "type": "string", "format": "uri", "pattern": "^https?://" },
      "thumbnail": { "type": "string" },
      "tags": {
        "type": "array",
        "items": { "type": "string" }
      },
      "status": { "type": "string", "enum": ["playable", "wip", "archived"] },
      "complexity": { "type": "string", "enum": ["simple", "complex"] }
    },
    "additionalProperties": true
  }
}
