[
  {
    "id": "gomoku",
    "title": "五子棋 Gomoku",
    "description": "15×15 五子棋，支援人機對戰與雙人 PK，AI 與棋盤邏輯用 Python 透過 Pyodide 直接在瀏覽器執行。",
    "url": "https://ychung1998.github.io/gomoku/",
    "thumbnail": "thumbnails/gomoku.png",
    "tags": ["棋類", "雙人", "人機對戰"],
    "status": "playable",
    "complexity": "simple"
  },
  {
    "id": "2048",
    "title": "2048",
    "description": "經典數字合併遊戲，方向鍵或滑動操作，合併出 2048。固定數字配色、合併特效與音效。",
    "url": "https://ychung1998.github.io/game-2048/",
    "thumbnail": "thumbnails/2048.png",
    "tags": ["益智", "數字", "單人"],
    "status": "playable",
    "complexity": "simple"
  },
  {
    "id": "othello",
    "title": "黑白棋 Othello",
    "description": "8×8 黑白棋，支援人機對戰與雙人 PK，AI 用 negamax + alpha-beta 剪枝並在殘局窮盡搜尋，Python 透過 Pyodide 在瀏覽器執行。",
    "url": "https://ychung1998.github.io/othello/",
    "thumbnail": "thumbnails/othello.png",
    "tags": ["棋類", "雙人", "人機對戰"],
    "status": "playable",
    "complexity": "simple"
  },
  {
    "id": "snake",
    "title": "貪吃蛇 Snake",
    "description": "經典貪吃蛇，方向鍵或滑動控制，吃食物變長並隨分數加速，撞牆撞自己遊戲結束。",
    "url": "https://ychung1998.github.io/game-snake/",
    "thumbnail": "thumbnails/snake.png",
    "tags": ["動作", "單人"],
    "status": "playable",
    "complexity": "simple"
  },
  {
    "id": "flappy",
    "title": "Flappy Bird",
    "description": "經典 Flappy Bird，點擊振翅穿越水管缺口，難度隨分數上升。物理與碰撞用 Python 透過 Pyodide 在瀏覽器執行。",
    "url": "https://ychung1998.github.io/game-flappy/",
    "thumbnail": "thumbnails/flappy.png",
    "tags": ["動作", "單人"],
    "status": "playable",
    "complexity": "simple"
  },
  {
    "id": "downstairs",
    "title": "小朋友下樓梯",
    "description": "NS-Shaft 式下樓梯：躲尖刺、踩彈簧、往深處走，樓層數就是分數。物理與台階生成用 Python 透過 Pyodide 在瀏覽器執行。",
    "url": "https://ychung1998.github.io/game-downstairs/",
    "thumbnail": "thumbnails/downstairs.png",
    "tags": ["動作", "單人"],
    "status": "playable",
    "complexity": "simple"
  },
  {
    "id": "minesweeper",
    "title": "踩地雷 Minesweeper",
    "description": "經典 Windows 95/98 風格踩地雷，三種難度、首擊安全、連鎖展開，左鍵挖格、右鍵插旗。",
    "url": "https://ychung1998.github.io/minesweeper/",
    "thumbnail": "thumbnails/minesweeper.png",
    "tags": ["益智", "單人"],
    "status": "playable",
    "complexity": "simple"
  },
  {
    "id": "solitaire",
    "title": "經典接龍 Klondike Solitaire",
    "description": "經典 Windows 風格紙牌接龍，點選式操作（點牌選取、點目的地移動、雙擊送基礎堆），抽 1 張／抽 3 張模式可切換。",
    "url": "https://ychung1998.github.io/solitaire/",
    "thumbnail": "thumbnails/solitaire.png",
    "tags": ["紙牌", "益智", "單人"],
    "status": "playable",
    "complexity": "simple"
  },
  {
    "id": "solve24",
    "title": "24點大師 Solve24",
    "description": "給 4 張撲克牌，用四則運算與括號湊出 24。同時支援 Streamlit 網頁介面與 FastMCP AI Tool。",
    "url": "https://solve24-game.onrender.com/",
    "thumbnail": "thumbnails/solve24.png",
    "tags": ["益智", "數字", "單人"],
    "status": "playable",
    "complexity": "complex"
  },
  {
    "id": "station-typing",
    "title": "站名打字競速（台北捷運版）",
    "description": "自由選起訖站，跨線轉乘也算得出來，沿路打站名（拼音／英文雙模式），火車依打字速度沿真實地理路網移動，結束後看正確率、WPM、分數與整趟軌跡回放。",
    "url": "https://station-typing.pages.dev/",
    "thumbnail": "thumbnails/station-typing.png",
    "tags": ["打字", "益智", "單人"],
    "status": "playable",
    "complexity": "complex"
  },
  {
    "id": "poker-push",
    "title": "雙人推撲克 Push Poker",
    "description": "擲骰子後拆成不同數字的牌推進中央，推進去的牌會把對手同數字的牌推回起點，先把 1～6 全部推進中央的人獲勝。可雙人同機、對戰電腦（簡單／困難），或用房間代碼線上對戰。",
    "url": "https://poker-push.yicheng-self.workers.dev/",
    "tags": ["紙牌", "雙人", "人機對戰", "線上對戰"],
    "status": "playable",
    "complexity": "complex"
  }
]
